{
  "$schema": "../Schemas/semantic-registry.schema.json",
  "schemaVersion": 1,
  "documentID": "AH-REGISTRY-STABLE-BOUNDARY-FAULTS-V1",
  "registryType": "stable-boundary-faults",
  "completeness": "complete",
  "sourceSpecification": {
    "path": "spec.md", "sha256": "be2571b6b9dc1eea3b5896dfbdb15c02595687ae137a897646c119cd200dcf62",
    "section": "8.1", "lineStart": 284, "lineEnd": 301
  },
  "entries": [
    { "id": "AH-FAULT-001-BEFORE", "boundaryOrdinal": 1, "boundary": "run-input snapshot creation", "phase": "before", "injectedFailure": "processTermination", "expectedRecovery": "No run is accepted and no composer-clearing projection is committed.", "requirementIDs": ["AH-RUN-002", "AH-PERSIST-001"], "testIDs": ["AHT-RECOVERY-001", "AHT-JOURNAL-001"] },
    { "id": "AH-FAULT-001-AFTER", "boundaryOrdinal": 1, "boundary": "run-input snapshot creation", "phase": "after", "injectedFailure": "processTermination", "expectedRecovery": "Explicit resume reuses the exact frozen input snapshot without rereading mutable sources.", "requirementIDs": ["AH-RUN-002", "AH-PERSIST-004"], "testIDs": ["AHT-RECOVERY-001"] },
    { "id": "AH-FAULT-002-BEFORE", "boundaryOrdinal": 2, "boundary": "context compilation", "phase": "before", "injectedFailure": "transactionRollback", "expectedRecovery": "No manifest is authoritative and compilation restarts from the frozen run snapshot.", "requirementIDs": ["AH-RUN-002", "AH-CONTEXT-001"], "testIDs": ["AHT-RECOVERY-001", "AHT-CONTEXT-001"] },
    { "id": "AH-FAULT-002-AFTER", "boundaryOrdinal": 2, "boundary": "context compilation", "phase": "after", "injectedFailure": "processTermination", "expectedRecovery": "The committed manifest is reused byte-for-byte and mutable Memory, Skill, or conversation data is not reread.", "requirementIDs": ["AH-RUN-002", "AH-CONTEXT-001"], "testIDs": ["AHT-RECOVERY-001", "AHT-CONTEXT-001"] },
    { "id": "AH-FAULT-003-BEFORE", "boundaryOrdinal": 3, "boundary": "completed model attempt", "phase": "before", "injectedFailure": "processTermination", "expectedRecovery": "Transient tokens are discarded and the model attempt restarts from the committed compiled request.", "requirementIDs": ["AH-RUN-002", "AH-MODEL-002"], "testIDs": ["AHT-RECOVERY-001", "AHT-MODEL-002"] },
    { "id": "AH-FAULT-003-AFTER", "boundaryOrdinal": 3, "boundary": "completed model attempt", "phase": "after", "injectedFailure": "processTermination", "expectedRecovery": "The committed normalized provider outcome is reused and inference is not repeated.", "requirementIDs": ["AH-RUN-002", "AH-MODEL-002"], "testIDs": ["AHT-RECOVERY-001", "AHT-MODEL-002"] },
    { "id": "AH-FAULT-004-BEFORE", "boundaryOrdinal": 4, "boundary": "normalized action validation", "phase": "before", "injectedFailure": "transactionRollback", "expectedRecovery": "Validation reruns without executing a tool or committing a final answer.", "requirementIDs": ["AH-RUN-002", "AH-LOOP-001"], "testIDs": ["AHT-RECOVERY-001", "AHT-LOOP-001"] },
    { "id": "AH-FAULT-004-AFTER", "boundaryOrdinal": 4, "boundary": "normalized action validation", "phase": "after", "injectedFailure": "processTermination", "expectedRecovery": "The recorded single normalized action is reused and no second repair budget is consumed.", "requirementIDs": ["AH-RUN-002", "AH-LOOP-001"], "testIDs": ["AHT-RECOVERY-001", "AHT-LOOP-001"] },
    { "id": "AH-FAULT-005-BEFORE", "boundaryOrdinal": 5, "boundary": "approval grant or denial", "phase": "before", "injectedFailure": "transactionRollback", "expectedRecovery": "The operation remains waiting for approval and no external execution begins.", "requirementIDs": ["AH-RUN-002", "AH-APPROVAL-001"], "testIDs": ["AHT-RECOVERY-001", "AHT-AUTH-001"] },
    { "id": "AH-FAULT-005-AFTER", "boundaryOrdinal": 5, "boundary": "approval grant or denial", "phase": "after", "injectedFailure": "processTermination", "expectedRecovery": "The committed receipt or denial is reused idempotently and no duplicate prompt changes authority.", "requirementIDs": ["AH-RUN-002", "AH-APPROVAL-001"], "testIDs": ["AHT-RECOVERY-001", "AHT-AUTH-001"] },
    { "id": "AH-FAULT-006-BEFORE", "boundaryOrdinal": 6, "boundary": "tool intent recording", "phase": "before", "injectedFailure": "transactionRollback", "expectedRecovery": "No external execute call is permitted because no durable intent exists.", "requirementIDs": ["AH-RUN-002", "AH-TOOLS-001"], "testIDs": ["AHT-RECOVERY-001", "AHT-TOOL-001"] },
    { "id": "AH-FAULT-006-AFTER", "boundaryOrdinal": 6, "boundary": "tool intent recording", "phase": "after", "injectedFailure": "processTermination", "expectedRecovery": "Pure or proven idempotent work may resume by policy; unknown non-idempotent outcome enters reconciliation instead of replay.", "requirementIDs": ["AH-RUN-002", "AH-RUN-005"], "testIDs": ["AHT-RECOVERY-001", "AHT-RECONCILE-001"] },
    { "id": "AH-FAULT-007-BEFORE", "boundaryOrdinal": 7, "boundary": "tool outcome recording", "phase": "before", "injectedFailure": "processTermination", "expectedRecovery": "An unproven side-effecting outcome is uncertain and cannot be reported as success or silently replayed.", "requirementIDs": ["AH-RUN-002", "AH-RUN-005"], "testIDs": ["AHT-RECOVERY-001", "AHT-RECONCILE-001"] },
    { "id": "AH-FAULT-007-AFTER", "boundaryOrdinal": 7, "boundary": "tool outcome recording", "phase": "after", "injectedFailure": "processTermination", "expectedRecovery": "The committed outcome is reused exactly once and the next batch ordinal is deterministic.", "requirementIDs": ["AH-RUN-002", "AH-LOOP-003"], "testIDs": ["AHT-RECOVERY-001", "AHT-LOOP-002"] },
    { "id": "AH-FAULT-008-BEFORE", "boundaryOrdinal": 8, "boundary": "artifact commit", "phase": "before", "injectedFailure": "writeFailure", "expectedRecovery": "No durable event references partial artifact bytes and orphan cleanup removes temporary content.", "requirementIDs": ["AH-RUN-002", "AH-ARTIFACT-001"], "testIDs": ["AHT-RECOVERY-001", "AHT-ARTIFACT-001"] },
    { "id": "AH-FAULT-008-AFTER", "boundaryOrdinal": 8, "boundary": "artifact commit", "phase": "after", "injectedFailure": "processTermination", "expectedRecovery": "The content-addressed artifact passes integrity verification and is reused without duplicate bytes.", "requirementIDs": ["AH-RUN-002", "AH-ARTIFACT-001"], "testIDs": ["AHT-RECOVERY-001", "AHT-ARTIFACT-001"] },
    { "id": "AH-FAULT-009-BEFORE", "boundaryOrdinal": 9, "boundary": "final answer commit", "phase": "before", "injectedFailure": "transactionRollback", "expectedRecovery": "The UI cannot treat the answer as committed and no Conversation JSON ghost answer exists.", "requirementIDs": ["AH-RUN-002", "AH-PERSIST-002"], "testIDs": ["AHT-RECOVERY-001", "AHT-OUTBOX-001"] },
    { "id": "AH-FAULT-009-AFTER", "boundaryOrdinal": 9, "boundary": "final answer commit", "phase": "after", "injectedFailure": "processTermination", "expectedRecovery": "The canonical answer and outbox command project idempotently without another model attempt.", "requirementIDs": ["AH-RUN-002", "AH-PERSIST-002"], "testIDs": ["AHT-RECOVERY-001", "AHT-OUTBOX-001"] },
    { "id": "AH-FAULT-010-BEFORE", "boundaryOrdinal": 10, "boundary": "pause cancellation or failure finalization", "phase": "before", "injectedFailure": "transactionRollback", "expectedRecovery": "Recovery classifies the still-active step from prior committed facts and does not fabricate a terminal or paused state.", "requirementIDs": ["AH-RUN-002", "AH-RUN-003"], "testIDs": ["AHT-RECOVERY-001", "AHT-RUN-002"] },
    { "id": "AH-FAULT-010-AFTER", "boundaryOrdinal": 10, "boundary": "pause cancellation or failure finalization", "phase": "after", "injectedFailure": "processTermination", "expectedRecovery": "The committed waiting or terminal state is unique, releases ownership, and never resumes automatically at launch.", "requirementIDs": ["AH-RUN-002", "AH-RUN-003", "AH-IOS-002"], "testIDs": ["AHT-RECOVERY-001", "AHT-RUN-002", "AHT-LAUNCH-001"] }
  ]
}
